Título|Fecha|Buesqueda por:
Evaluacion Hidrogeológica y de Contaminación de Acuíferos en la Zona Bananera de Santa Marta. Departamento del Magdalena. Informe final. Año 1998|Fecha: 01/12/1998|Hidrogeología
Atlas de Aguas Subterráneas de Colombia. Cobertura Estado del Recurso. Plancha 5-14.-|Fecha: 31/12/2002|Hidrogeología
Necesidad de Evaluar el Recurso y Soluciones de Contingencia para el Abastecimiento. El recurso de Agua Subterránea en el Departamento de la Guajira. Producto año 1998|Fecha: 01/02/1998|Hidrogeología
Manejo Integrado y Sostenible de los Recursos Hidricos Subterráneos en Ameríca Latina.|Fecha: 01/10/2000|Hidrogeología
Aspectos técnicos para la formulación de planes de protección de aguas subterráneas. -|Fecha: 01/01/2001|Hidrogeología
Evaluación Integral del Recurso Hídrico Subterráneo en el País.|Fecha: 01/02/1999|Hidrogeología
Boletín Geológico - Volumen 25, No. 1 -|Fecha: 01/12/1982|Hidrogeología
Mapa Hidrogeológico de Córdoba, escala 1:250.000. Consideraciones Técnicas para el Manejo del Agua Subterranea en el Departamento de Córdoba. Versión año 2003. Producto|Fecha: 01/10/2003|Hidrogeología
Exploración Hidrogeológica Regional de Córdoba y Sucre. Mapa de Inventario de Puntos de Agua del Departamento de Sucre.|Fecha: 01/12/1999|Hidrogeología
Exploración y Evaluación de Aguas Subterráneas - Estado actual y proyecciones.|Fecha: 18/06/2002|Hidrogeología
Informe Preliminar de la Hidrología del Proyecto Atlántico- Bolívar. Año 1981. Informe 1862|Fecha: 01/12/1983|Hidrogeología
Geología del Departamento de Bolívar al Norte del Canal del Dique. -|Fecha: 01/06/1985|Hidrogeología
Informe de Caracterización Geoquímica e Isotópica de los Acuíferos de la Cuenca alta del Río Bogotá. Año 2001|Fecha: 01/10/2001|Hidrogeología
Aplicación de Técnicas Isotópicas en Aguas Subterráneas Col/8/019. Primer Informe Parcial de Actividades.|Fecha: 01/07/1997|Hidrogeología
Prospectiva y Perspectiva del Agua en Colombia y en el Departamento de Sucre.|Fecha: 01/06/2003|Hidrogeología
Prospección geoeléctrica para aguas subterráneas en la región septentrional del departamento de Bolívar. -|Fecha: 01/09/1985|Hidrogeología
Perforación de pozos profundos en los Departamentos de Atlántico y Bolívar al norte del Canal del Dique. Año 1985. Informe 1969|Fecha: 01/01/1985|Hidrogeología
Investigación geoeléctrica en la evaluación de reservas de grava y arena, cantera La Fiscala (Concretos Diamante), Bogotá, D. E. -|Fecha: 01/10/1978|Hidrogeología
Evaluación de la Recarga Proveniente de la Precipitación en la Zona Central, Sur y Oriente de la Sabana de Bogotá. Año 1991. Informe 2284|Fecha: 01/03/1991|Hidrogeología
Exploración de acuíferos de la Alta y Media Guajira. Capitulo II. Prospección Geofísica. Año 1973-1975. Informe 1668|Fecha: 01/06/1975|Hidrogeología
Exploración de Acuíferos de la Alta y Media Guajira. Capitulo I. Geología. Versión Año 1976. Informe 1668 A. Producto|Fecha: 01/12/1976|Hidrogeología
Proyecto Plan de Uso y Manejo de Corrientes Superficiales del Municipio de Zambrano, Volumen Hidrologia e Hidráulica de las Corrientes Superficiales. Versión año 1997. Producto|Fecha: 28/02/1997|Hidrogeología
Geoeléctrica entre Buga y Cartago, Valle del Cauca. Versión año 1976. Informe 1696. Producto|Fecha: 01/06/1976|Hidrogeología
Exploración de Acuíferos del Valle Medio del Magdalena. Escala 1:50.000. Versión Año 1976. Informe 1697. Producto|Fecha: 01/07/1976|Hidrogeología
Concepto Técnico Evaluación Impacto Ambiental Explotación del Pozo 170-II-D-001, vereda Pozo Negro, municipio de Barbosa. Versión año 2002. Producto|Fecha: 01/02/2002|Hidrogeología
Construcción de un Pozo para Explotación de Aguas Subterráneas en Chenche, Socorro, Los Guayabos, Municipio de Coyaima, Tolima. Versión año 1999. Informe 2328. Producto|Fecha: 01/06/1999|Hidrogeología
Exploración y Evaluación Regional de Aguas Subterráneas en el Área Metropolitana de Bucaramanga. Departamento de Santander. Escala 1:25.000. Versión año 2002. Producto|Fecha: 13/06/2002|Hidrogeología
Estudio Hidrogeológico en el Valle del Patía .Versión año 1991.Informe 2285|Fecha: 01/12/1991|Hidrogeología
Mapa Geomorfológico Hoya Hidrográfica del Río Zulia, Cuenca de los Ríos Tachira y Pamplonita|Fecha: 01/01/1964|Hidrogeología
Estudio Hidrogeológico en terrenos del nuevo colegio de Nuestra Señora del Rosario, Bogotá. Versión año 1953. Informe 962. Producto|Fecha: 01/10/1953|Hidrogeología
El Aprovechamiento de Energía Hidráulica en la Cuenca del Rio Bobo. Departamento de Nariño. Versión año 1940. Informe 325. Producto|Fecha: 14/10/1940|Hidrogeología
Informe de Reconocimiento: Fuente Termal El Volcán de Ciénaga, Magdalena. Año 1999|Fecha: 01/09/1999|Hidrogeología
Informe sobre las manifestaciones de cobre de El Tuto y Cascajales - Norte de Santander. Versión año 1973.|Fecha: 01/12/1973|Hidrogeología
Resultados de la perforación, construcción y análisis del pozo 283-I-C-Coyarco 1, Cabildo Indígena Coyarco. Municipio de Coyaima – Tolima. Año 2001|Fecha: 01/08/2001|Hidrogeología
Informe de Labores Durante la Decada 1960-1969. Informe 1561. Versión año 1970. Producto|Fecha: 01/08/1970|Hidrogeología
Estratigrafía, Facies y Ambiente de Depósito de la Formación Tambor|Fecha: 01/01/1986|Hidrogeología
Informe de la Geología del Pozo Nereidas 1 - Contrato Geoenergía Andina S.A. - GESA. Producto. Versión año 1997. Informe 2288|Fecha: 01/09/1997|Hidrogeología
Diagnóstico y asistencia técnica, explotación y fomento de la minería en el departamento. Inventario minero en el departamento de Cundinamarca Fase II - Parte 1. Aspectos generales. Versión año 1999.|Fecha: 01/05/1999|Hidrogeología
Estudio Geomorfológico e Hidrológico Regional de la cuenca del Río Mocoa y evaluación detallada de un sitio crítico. Anexos. Versión año 1994. Informe 2364. Producto|Fecha: 01/12/1994|Hidrogeología
Informe Anual 1972. -Direcciones regionales de Sogamoso, Medellin, Ibague y Bucaramanga. -|Fecha: 01/01/1972|Hidrogeología
Inventario Minero Nacional. Información Primaria. Contrato 238 de 1999.Escala 1:500.000. Versión año 2000. Producto|Fecha: 31/07/2000|Hidrogeología
Resultados de la Perforación, Construcción y Análisis del Piezómetro 227-IV D-104. Año 2002|Fecha: 01/06/2002|Hidrogeología
Posibilidades de embalse del arroyo Parash, bahía Honda, Guajira|Fecha: 01/11/1976|Hidrogeología
Compilación de Las Perforaciones Realizadas en el Área de La Sabana de Bogotá. Versión año 1967. Informe 1533. Producto|Fecha: 01/08/1967|Hidrogeología
Informe de la Visita Técnica al Relleno Sanitario de la Ciudad de Tunja Boyacá. Versión año 2005. Producto|Fecha: 20/09/2005|Hidrogeología
Informe de Labores Durante 1960-1961 Presentado por el Director del Servicio Geologico Nacional. Versión año 1961. Producto|Fecha: 01/06/1961|Hidrogeología
Zonificación de Amenaza por Movimientos en Masa en el Municipio de Cáqueza Cundinamarca. Versión año 2013. Producto|Fecha: 01/01/2013|Hidrogeología
Informe de Labores Durante 1962-1963 Presentado por el Director del Servicio Geologico Nacional -|Fecha: 01/06/1963|Hidrogeología
Zonificación Geomecánica de la Sabana de Bogotá. Año 2004|Fecha: 30/12/2004|Hidrogeología
Observaciones Preliminares para la Planta Piloto de Paipa. Departamento de Boyacá. Versión año 1943. Informe 386. Producto|Fecha: 30/04/1943|Hidrogeología
Recursos Carboníferos área Úmbita-Laguna de Tota|Fecha: 01/12/2008|Hidrogeología
Mapa Hidrogeológico en el área del Alto Patía. Proyecto SUB09-21 Aguas Subterráneas. Escala 1:100.000. Versión año 2010. Producto|Fecha: 01/12/2010|Hidrogeología
Investigación Geológica e Hidrogeológica en los Sectores Norte y Centro del Departamento de Boyacá. Versión año 2007. Producto|Fecha: 01/12/2007|Hidrogeología
Proyecto de investigación Geológica, Sísmica y Geotérmica en el Altiplano Nariñense. Tomo I. Convenio Interistitucional 046/2005. Producto año 2007|Fecha: 01/03/2007|Hidrogeología
Mapa de Inventario de puntos de Agua Subterranea - Macizo de Santander -|Fecha: 31/12/2007|Hidrogeología
Proyecto de Investigación Geológica e Hidrogeológica en La Región Central del Departamento de Santander. Tomo I. Investigación Geológica e Hidrogeológica en el Macizo de Santander. Acuerdo Específico 002/05. Versión año 2007. Producto|Fecha: 01/04/2007|Hidrogeología
Memoria explicativa de la investigación geológica e hidrogeológica en la zona Guanentina. Tomo II. Proyecto de investigación geológica e hidrogeológica en la región central del Departamento de Santander. Producto|Fecha: 01/04/2007|Hidrogeología
Mapa de Inventario de puntos de Agua Subterranea con conductividad eléctrica de la región Guanentina - Departamento de Santander -|Fecha: 31/12/2007|Hidrogeología
Integración Geológica e Hidrogeológica del Centro de Santander. Versión año 2010. Producto|Fecha: 01/04/2010|Hidrogeología
Observaciones Sobre las Calizas de Toluviejo.|Fecha: 01/01/1962|Hidrogeología
Mapa litoestratigráfico con permeabilidades de Colombia. Plancha 5-04. Escala 1:500.000|Fecha: 01/02/2011|Hidrogeología
Mapa litoestratigráfico con permeabilidades de Colombia. Plancha 5-13. Escala 1:500.000|Fecha: 01/02/2011|Hidrogeología
Mapa litoestratigráfico con permeabilidades de Colombia. Plancha 5-14. Escala 1:500.000. Versión año 2011. Producto|Fecha: 01/02/2011|Hidrogeología
Programa estratégico para la investigación y modelamiento del sistema hidrotermal magmático en áreas con potencial geotérmico localizadas en el Flanco Noroccidental del Volcán Nevado del Ruíz, Colombia. Producto|Fecha: 01/07/2012|Hidrogeología
Prospección Geoeléctrica Para Agua Subterránea en las Localidades de Río Frío, Urbanización La Arenosa, Hacienda Lisboa y Sector del Tanque del Acueducto del Municipio de Rivera Departamento de Huila.|Fecha: 01/01/2003|Hidrogeología
Mapa litoestratigráfico con permeabilidades de Colombia. Plancha 5-23. Escala 1:500.000|Fecha: 01/06/2010|Hidrogeología
Mapa litoestratigráfico con permeabilidades de Colombia. Plancha 5-19. Escala 1:500.000|Fecha: 01/06/2010|Hidrogeología
Mapa litoestratigráfico con permeabilidades de Colombia. Plancha 5-20. Escala 1:500.000|Fecha: 01/06/2010|Hidrogeología
Mapa litoestratigráfico con permeabilidades de Colombia. Plancha 5-18. Escala 1:500.000|Fecha: 01/06/2010|Hidrogeología
Mapa litoestratigráfico con permeabilidades de Colombia. Plancha 5-15. Escala 1:500.000|Fecha: 01/06/2010|Hidrogeología
Mapa litoestratigráfico con permeabilidades de Colombia. Plancha 5-10. Escala 1:500.000|Fecha: 01/06/2010|Hidrogeología
Mapa litoestratigráfico con permeabilidades de Colombia. Plancha 5-08. Escala 1:500.000|Fecha: 01/06/2010|Hidrogeología
Mapa litoestratigráfico con permeabilidades de Colombia. Plancha 5-07. Escala 1:500.000|Fecha: 01/06/2010|Hidrogeología
Mapa litoestratigráfico con permeabilidades de Colombia. Plancha 5-05. Escala 1:500.000|Fecha: 01/06/2010|Hidrogeología
Mapa litoestratigráfico con permeabilidades de Colombia. Plancha 5-09. Escala 1:500.000. Versión año 2011. Producto|Fecha: 01/02/2011|Hidrogeología
Problemas de Abastecimiento de Agua en Villanueva, Departamento de Santander. Versión año 1983. Producto|Fecha: 01/09/1983|Hidrogeología
Irrigación Ponedera - Candelaria. Especificaciones y Planos de Construcción. Departamento del Atlántico. Versión año 1951. Informe 856. Producto|Fecha: 01/12/1951|Hidrogeología
Mapas Ordenamiento territoria. - Municipio Jordán - Departamento de Santander.- Geologia y tectonica -Geomorfologia-uso del suelo, etc.|Fecha: 31/12/2006|Hidrogeología
Informe de la Investigación sin Terminar Sobre las Posibilidades Minerales Económicas de La Reserva Petrolífera del Gobierno en el Departamento de Norte de Santander. Versión año 1940. Informe 111. Producto|Fecha: 05/12/1940|Hidrogeología
Informe de la comisión realizada en las vecindades de la ciudad de Cúcuta, donde se adelantan trabajos para obtener agua artesiana. Versión año 1944. Informe 406. Producto|Fecha: 30/07/1944|Hidrogeología
Monografía del Municipio de Iles. Departamento de Nariño. Escala 1:50.00. Versión año 1952. Informe 836. Producto|Fecha: 01/02/1952|Hidrogeología
Informe Sobre los Trabajos Ejecutados en la Oficina y Laboratorio de Petrográfica Durante 1936 - 1938. Informe 61. Producto|Fecha: 19/01/1938|Hidrogeología
Informe de Labores Durante 1959 - 1960 del Servicio Geologico Nacional Presentado por el Director. Versión año 1960. Producto|Fecha: 28/06/1960|Hidrogeología
Columnar Seccions. Quebrada Mira, Río de Oro, East Side of Dome, Río La Danta, Las Mercedes District, Quebrada Rasgadera, Las Mercedes District. Versión año 1938. Producto|Fecha: 01/01/1938|Hidrogeología
Resumen de Zonas Potencialmente Acuíferas en Cúcuta.|Fecha: 01/11/2003|Hidrogeología
Geología del valle alto del río Cauca en los departamentos del Valle y Cauca.|Fecha: 01/01/1969|Hidrogeología
00-347-0005 Estudio de suelos|Fecha: 01/06/1995|Hidrogeología
Mapa básico de suelos -Distrito de irrigación del río Coello -Departamento del Tolima|Fecha: 01/01/1955|Hidrogeología
0-263-0054 Estudio de suelos y recomendaciones de cimentación|Fecha: 01/06/1995|Hidrogeología
Abasto de agua para la hacienda La Picota. Versión año 1929. Informe 181. Producto|Fecha: 11/04/1929|Hidrogeología
Libreta de campo - Prueba de bombeo - Pozo el Cairo|Fecha: 18/11/1985|Hidrogeología
Libreta de campo - Pozo Madrid 6|Fecha: 14/11/1981|Hidrogeología
Perfil Geológico Transversal - N-002 - Proyecto Explotación de Carbón Mina El Cerrejón (Carbocol) - Línea N-002.-|Fecha: 25/09/1981|Hidrogeología
Evaluación Hidrogeológica de Córdoba y Sucre. Departamento de Sucre. Informe de Recopilación de Información. -|Fecha: 01/12/1999|Hidrogeología
Memoria Técnica de la Plancha 5-14. Informe de Avance.|Fecha: 01/06/2002|Hidrogeología
Aprovechamiento hidroeléctrico del río Saldaña. Estudio de prefactibilidad técnica - Memoria final - Apéndice B.|Fecha: 01/11/1976|Hidrogeología
Libreta de campo - Proyecto Caribe - II Comisión. Transversa Carreto - Lata, vía hacia La Torre.|Fecha: 26/02/1992|Hidrogeología
Libreta de campo - Geología del municipio del Carmén de Bolívar - Octubre 09 de 1992|Fecha: 09/10/1992|Hidrogeología
Libreta de campo - Tolima - 1975|Fecha: 10/01/1975|Hidrogeología
Área jurisdicción de la CAR -Plan maestro de calidad de aguas superficiales -Mapa No. 8.2.1|Fecha: 01/01/1990|Hidrogeología
Curvas Acumulativas de Arenas Pleistocénicas de la Región del Río Atabapó - Figura No. 1 -|Fecha: 01/12/1975|Hidrogeología
Estudio Geológico - Geoeléctrico para La Ubicación de un Pozo para Abastecimiento de Agua Subterránea en La Finca Sansa Flowers LTDA, Tenjo Cundinamarca. Versión año 1985. Informe 2020. Producto|Fecha: 01/10/1985|Hidrogeología
Mapa geológico preliminar - Plancha 281 - Rioblanco. Mapa Sepía versión 1982|Fecha: 01/01/1982|Hidrogeología
Abastecimiento de agua para la región de Bahía Honda, Guajira. -|Fecha: 01/09/1971|Hidrogeología
Columna estratigráfica generalizada de la formación Morroa - Camino Las Flores - Morroa - Corozal - Figura No 3|Fecha: 03/07/1979|Hidrogeología
Estudio hidrogeológico del Acuífero de Morroa - Columna estratigráfica generalizada de la formación Morroa Camino las Flores - Morroa - Corozal|Fecha: 01/08/1992|Hidrogeología
Análisis de la dinámica fluvial de algunos ríos de la cuenca de los Llanos Orientales -Ríos Cravo Sur. Sector F-G -V.C.0.1 [Preliminar con anotaciones]|Fecha: 01/11/1995|Hidrogeología
Anexo Plancha 223. Versión año 1983. Informe 1914. Producto|Fecha: 31/12/1983|Hidrogeología
Estudio Geoeléctrico para Prospección de Aguas Subterráneas en la Finca La Pintada, Senador Eugenio Díaz. Corregimiento el Morro, Municipio de Tubará. Versión año 1998. Producto|Fecha: 01/01/1998|Hidrogeología
Declaración de impacto ambiental del aprovechamiento de aguas termales para las pisinas del hotel - Hotel Panorama - Paipa Boyacá|Fecha: 01/02/1993|Hidrogeología
Manejo integrado y Sostenible de los Recursos hídricos Subterráneo en América Latina - Documento del proyecto - RLA/8/031|Fecha: 01/09/2001|Hidrogeología
Análisis y Evaluación de la Información Existente en la Subcuenca del Río Subachoque. Primer Informe.|Fecha: 01/06/2002|Hidrogeología
Informe del reconocimiento de los volcanes de lodo de la Costa Atlántica colombiana y de aguas minerales del municipio de Usiacurí, departamento del Atlántico. (Preliminar). -|Fecha: 01/12/2000|Hidrogeología
Registro grafico compuesto - pozo el Nabil - Análisis de los resultados de la construcción del pozo ``Nabil`` Maicao (Guajira) - figura 1|Fecha: 04/12/1994|Hidrogeología
Estudio geoeléctrico realizado en el Municipio de Barichara - Departamento de Santander - Informe|Fecha: 01/01/2000|Hidrogeología
Perfiles Geoeléctricos A-A`, B-B´, C-C´ - Diseño y Ejecución Plan Monitoreo del Sistema de Inyección de Aguas de Producción Generadas en las Facilidades Centrales de Producción (CPF) - Plancha 3.2|Fecha: 01/02/1995|Hidrogeología
Informe de las Labores realizadas por el Servicio Geológico Nacional durante el año de 1951. Informe 807. Producto|Fecha: 31/12/1951|Hidrogeología
Memorándum sobre una Propuesta para Trabajos Hidrológicos Preliminares y sobre la Estimación de los Costos de un Acueducto para la Urbanización de la Isla del Morro. Departameto de Nariño. Versión año 1952. Informe 869. Producto|Fecha: 01/09/1952|Hidrogeología
Informe sobre las posibilidades de aguas subterráneas en los terrenos de la Escuela Militar de Cadetes, Bogotá. Versión año 1954. Informe 980. Producto|Fecha: 01/01/1954|Hidrogeología
Columna estratigráfica detallada, (arroyos el Cerrito-Platanalcito) - Figura 2 -|Fecha: 01/12/1964|Hidrogeología
Laguna de Tota. Departamento de Boyacá. Versión año 1927. Informe 160. Producto|Fecha: 01/05/1927|Hidrogeología
Las fuentes calientes de Tabio. Versión año 1918. Informe 380. Producto|Fecha: 05/11/1918|Hidrogeología
Anotaciones Sobre Trabajos Hidrológicos Preliminares y Sobre el Proyecto del Acueducto para la Escuela de Policía General Santander en la Vecindad de Bogotá. Versión año 1954. Informe 1048. Producto|Fecha: 01/09/1954|Hidrogeología
Bibliografía de los estudios referentes a aguas subterráneas, que pueden ser consultados en el Instituto Geológico Nacional. -|Fecha: 31/12/1956|Hidrogeología
Libreta de campo - Comisión. Reconocimiento General de la Serrania de la Guajira. Para Aprovechamiento de Aguas.|Fecha: 21/09/1971|Hidrogeología
Informe Geológico Sobre la Hoya Hidrográfica de La Laguna de Tota. Boyacá. Versión año 1928. Informe 130. Producto|Fecha: 17/10/1928|Hidrogeología
Informe de las labores del Servicio Geológico Nacional en el Mes de Febrero de 1953. Versión año 1953. Producto|Fecha: 31/03/1953|Hidrogeología
Labores del Instituto Geológico Nacional en Abril de 1953 -|Fecha: 31/05/1953|Hidrogeología
Análisis de los resultados de la construcción de los pozos Nazareth 2,3 y 4. Año 1990|Fecha: 01/07/1990|Hidrogeología
Proyecto IGAC-ORSTOM - Estudio Regional Integrado del Altiplano Cundiboyacense.-|Fecha: 31/12/1981|Hidrogeología
Modelo Conceptual Hidrogeológico Preliminar Sector Industrial de ACOPI - Mpio. Yumbo Departamento del Valle del Cauca.|Fecha: 01/01/1999|Hidrogeología
Estudio Geoeléctrico en El Corregimiento de Santiago Apóstol para Explotación de Aguas Subterráneas. Versión año 1996. Producto|Fecha: 01/01/1996|Hidrogeología
Informe Final de Geología e Ingeniería Asociado -Contrato R177 La Jagua De Ibirico-|Fecha: 01/04/1996|Hidrogeología
Informe Preliminar Sobre el abasto con Agua de la Población de Suba. Cundinamarca. Versión año 1952. Informe 829. Producto|Fecha: 21/03/1952|Hidrogeología
Informe Geologico sobre la captación de aguas para el acueducto de Municipio de Boavita. Depto. de Boyacá. Versión año 1948. Informe 622. Producto|Fecha: 19/01/1948|Hidrogeología
Caracterización de las Aguas Consumidas por Algunas Poblaciones Localizadas en el Área de Influencia de la Avalancha del Nevado del Ruiz. Versión año 1986. Producto|Fecha: 01/02/1986|Hidrogeología
Informe Final: Resultados de la Perforación, Construcción y Análisis del Pozo 283-I-A-048 Angostura, Municipio de Coyaima, Tolima.-|Fecha: 01/03/2004|Hidrogeología
Estudio Hidrogeológico de los pozos y aljibes de Villavicencio. Versión año 1952. Informe 846. Producto|Fecha: 01/06/1952|Hidrogeología
Informe de Labores Durante 1963-1964 Presentado por el Director del Servicio Geologico Nacional -|Fecha: 01/06/1964|Hidrogeología
Evaluación de la disponibilidad del recurso hídrico para abastecimiento de agua potable en el sur del departamento de Bolivar - Producto|Fecha: 01/03/1994|Hidrogeología
Exploración de Aguas Subterráneas en la Región Central de Santander. Síntesis. Versión año 2010. Producto|Fecha: 01/07/2010|Hidrogeología
Un Pozo de prueba para agua en la Granja Agropecuaria de Girardot. Año 1958. Informe 1307|Fecha: 01/11/1958|Hidrogeología
Adendo al estudio de impacto ambiental de la explotación aurífera de Ataco - Tolima.- Volúmen IV, Calidad del agua, Informe final.|Fecha: 01/02/1992|Hidrogeología
Complementación estudio geoeléctrico vereda La Doctrina municipio de Velez Santander.|Fecha: 01/05/2002|Hidrogeología
Prospección Geoeléctrica en el Área Metropolitana de Bucaramanga.-|Fecha: 01/04/2003|Hidrogeología
Proyectos Ejecutados y Presentados al Gobierno Antes y Durante 1985 -|Fecha: 01/12/1985|Hidrogeología
Resultados de Dos Perforaciones de Ensayo en Mosquera, Cundinamarca. Versión año 1957. Informe 1219. Producto|Fecha: 01/02/1957|Hidrogeología
Aljibes para Puerto Bogotá, Cundinamarca. Versión año 1953. Informe 905. Producto|Fecha: 01/03/1953|Hidrogeología
Fuentes saladas del Municipio de Nimaima, Cundinamarca. Escala 1:25.000. Versión año 1957. Informe 1237. Producto|Fecha: 01/08/1957|Hidrogeología
Abastecimiento de agua potable para Quebrada Negra, Cundinamarca : Informe preliminar. -|Fecha: 01/06/1978|Hidrogeología
Aspectos Geológicos de la Franja Litoral entre Galerazamba y Barranquilla - Producto|Fecha: 01/01/1997|Hidrogeología
Informe Sobre el Pozo 24 I D-1 (Pozo Profundo No. 12) Construido por el Ingeominas en el Municipio de Sabanarlaga (Atlántico) Según Contrato CP-022/81 con Insfopal (Proyecto Call 74-27) -|Fecha: 31/07/1984|Hidrogeología
Reconocimiento geológicos ambiental en las canteras localizadas en la vereda Aguas Prietas - Turbaco - Producto|Fecha: 01/06/1988|Hidrogeología
Perforación, análisis y resultados obtenidos en la construcción del pozo 24 II B-21 Remolino - 2- Producto|Fecha: 01/10/1992|Hidrogeología
Instalación de la Red de Piezómetros en el Sector de Cobe. Informe de Comisión sobre la perforación.-|Fecha: 01/07/1997|Hidrogeología
Perforación, análisis y resultados obtenidos en la construcción del pozo 34 III A 47 Aguas Blanca(Cesar)- Producto|Fecha: 01/09/1993|Hidrogeología
Prospección geoeléctrica para agua subterránea en la vereda Tovar del municipio del Guamo Tolima.|Fecha: 01/07/2002|Hidrogeología
La posible Construcción de un Acueducto alimentado con Agua Subterránea para el Municipio de Bosa, Cundinamarca. Escala 1:25.000. Versión año 1952. Informe 861. Producto|Fecha: 01/08/1952|Hidrogeología
Estudio sobre algunas aguas minerales de Nariño. Ubicación de los Manantiales de Aguas Minerales. Escala 1:100.000. Versión año 1953. Informe 941. Producto|Fecha: 01/07/1953|Hidrogeología
Informe. Perforación, Construcción y Análisis del Pozo 323-IV-C-016 Río Frío 1. Rivera - Huila. Año 2003|Fecha: 01/05/2003|Hidrogeología
Perfil Geoeléctrico D - D` -Río Cali - Base Aerea -|Fecha: 28/02/2005|Hidrogeología
Informe sobre el desarrollo del proyecto prospección hidrogeológica en los departamentos de Atlántico y Bolívar - Producto|Fecha: 28/01/1983|Hidrogeología
Análisis estructural en la zona occidental del Volcán Nevado del Ruíz. Producto|Fecha: 01/03/2012|Hidrogeología
Informe de Labores Durante 1961-1962 Presentado por el Director del Servicio Geológico Nacional al señor Ministro de Minas y Petróleos. Versión año 1962. Producto|Fecha: 01/06/1962|Hidrogeología
Agua Potable para el Municipio de Nocaima, Departamento de Cundinamarca. Versión año 1952. Informe 875. Producto|Fecha: 01/10/1952|Hidrogeología
Estudio geológico, geomorfológico y evaluación geoambiental del sector suroriental de la Alta Guajira - Una estrategia para su desarrollo sostenible - Producto|Fecha: 01/12/1996|Hidrogeología
Abastecimiento del hotel de turismo Pipatón con agua subterránea Barrancabermeja, Santander. Versión año 1952. Informe 831. Producto|Fecha: 01/01/1952|Hidrogeología
Breves anotaciones sobre el Abastecimiento de Agua en varias Poblaciones del Departamento del Atlántico. Versión año 1953. Informe 923. Producto|Fecha: 01/06/1953|Hidrogeología
Boletín Geológico Volumen V Nº 1. Versión año 1957. Informe 1207. Boletín|Fecha: 01/12/1957|Hidrogeología
Estudio técnico-económico de factibilidad minera proyecto carbonífero de Puerto Libertador, Departamento de Córdoba|Fecha: 10/04/1984|Hidrogeología
Perforación, análisis y resultados obtenidos en la construcción del pozo 38 II C-2 y C-3 Tenerife, Magdalena. Carta técnica 121. Año 1992|Fecha: 01/01/1992|Hidrogeología
Prospección geoeléctrica para agua subterránea al norte del municipio de Vélez en la vereda Peña Tambor.|Fecha: 01/07/2002|Hidrogeología
La reutilización de aguas residuales para recarga de acuíferos en España. Experiencias, Proyectos y Planes.|Fecha: 23/05/1996|Hidrogeología
Abasto de Mercaderes con Agua Potable. Departamento del Cauca. Versión año 1952. Informe 813. Producto|Fecha: 18/01/1952|Hidrogeología
